{
  "schema_version": "interaction_trace.v0",
  "case_id": "D-B-RT01",
  "session_id": "D-B-RT01-S04",
  "policy_profile": "dev_verbose",
  "trace_created_at": "2026-03-29T21:55:03Z",
  "turns": [
    {
      "turn_index": 1,
      "timestamp": "2026-03-29T00:00:10Z",
      "role": "assistant",
      "phase": "info_gathering",
      "message_summary": "Session opening \u2014 establish Solomon's role, set process expectations, and invite parties to begin articulating their concerns",
      "state_delta": {
        "facts_added": [
          "Session is at initiation stage with no substantive content exchanged",
          "Issue domain completely unidentified \u2014 no information about what disputes or decisions need addressing"
        ],
        "facts_revised": [],
        "facts_structured": [],
        "positions_added_or_updated": [],
        "positions_structured": [],
        "open_questions_added": [
          "What issues bring the parties to mediation",
          "What each party's primary concerns are"
        ],
        "open_questions_resolved": [],
        "missing_info_structured": [],
        "issue_map_updates": [],
        "issue_updates_structured": [],
        "packages_structured": [],
        "option_state_updates": [],
        "escalation_state_updates": []
      },
      "risk_check": {
        "triggered": false,
        "signals": [],
        "severity": 1,
        "notes": "No safety signals present at session opening. Standard M0 process support is appropriate. No basis yet for identifying vulnerability, coercion, or incapacity concerns \u2014 these will require monitoring as parties begin to engage."
      },
      "candidate_escalation_category": null,
      "candidate_escalation_mode": null,
      "confidence_note": "Turn 1 opening statement. Perception will require updating once parties engage. Process design is standard session framing \u2014 role clarification, neutrality statement, and invitation to speak.",
      "message_text": "Welcome to both of you. I'm Solomon, and I'm here to support the structure of this mediation session \u2014 not to make decisions for you, but to help you both surface what matters, identify where your interests might align, and work toward agreements that you both can accept.\n\nA few things about how this works: I'm neutral. I won't take sides or tell you what the right outcome is. I'm also not a lawyer or a therapist \u2014 if legal questions come up, or if either of you needs support beyond what this process can offer, I'll flag that. My role is to keep this process safe, structured, and focused on your interests.\n\nWhat I'd like to do now is hear from each of you about what brings you here \u2014 what decisions need to be made, and what concerns you're carrying into this conversation. There's no right order, but I need to hear from both of you before we start working on options.\n\nWho would like to start?",
      "interaction_observations_delta": [
        "[PERCEPTION:PARTY_A] emotional=neutral_baseline posture=unknown_awaiting_engagement",
        "[PERCEPTION:PARTY_B] emotional=neutral_baseline posture=unknown_awaiting_engagement",
        "[PERCEPTION:DYNAMIC] unestablished_session_opening",
        "[DOMAIN:GAPS] What issues bring the parties to mediation; What each party's primary concerns are; Whether children are involved",
        "[OPTION_SCAN] premature_option_work=True \u2014 options deferred",
        "[PERCEPTION:DIVERGENCE] scaffold=cooperative_and_stable lm=unestablished_session_opening"
      ],
      "reasoning_trace": {
        "source": "lm_runtime",
        "model_id": "claude-sonnet-4-5",
        "perception": {
          "party_a": {
            "emotional_state": "neutral_baseline",
            "inferred_interests": [],
            "risk_signals": [],
            "relational_posture": "unknown_awaiting_engagement"
          },
          "party_b": {
            "emotional_state": "neutral_baseline",
            "inferred_interests": [],
            "risk_signals": [],
            "relational_posture": "unknown_awaiting_engagement"
          },
          "relational_dynamic": "unestablished_session_opening",
          "perception_confidence": "low",
          "perception_notes": [
            "Turn 1 represents session initiation \u2014 no party input has been received",
            "Neither party has spoken yet, so emotional state and relational posture reflect baseline expectations rather than observed signals",
            "No basis yet for inferring interests, identifying risk signals, or assessing relational dynamic",
            "Perception will require significant revision once parties begin to engage"
          ],
          "scaffold_divergence": "scaffold assessed relational_dynamic='cooperative_and_stable'; model assessed 'unestablished_session_opening'"
        },
        "domain_analysis": {
          "key_constraints": [
            "Session is at initiation stage with no substantive content exchanged",
            "Issue domain completely unidentified \u2014 no information about what disputes or decisions need addressing",
            "No party positions or interests have been articulated",
            "Jurisdictional context unknown",
            "Asset/debt scope unknown",
            "Parenting arrangements (if any) unknown"
          ],
          "material_gaps": [
            "What issues bring the parties to mediation",
            "What each party's primary concerns are",
            "Whether children are involved",
            "What decisions need to be made",
            "Each party's underlying interests and needs"
          ],
          "domain_notes": "Pre-computed assessment is accurate. This is a correct application of 'blocked' status \u2014 option work cannot proceed without any understanding of what is in dispute. The session must establish its scope and elicit initial positions before any option exploration is possible.",
          "option_readiness": "blocked"
        },
        "option_scan": {
          "candidate_options": [],
          "qualified_options": [],
          "premature_option_work": true,
          "deferral_reason": "Turn 1 session opening \u2014 no party input received yet. Cannot generate options without knowing what issues are in dispute or what either party's interests are. Must first establish session frame and invite parties to articulate their concerns."
        },
        "safety_assessment": {
          "escalation_needed": false,
          "candidate_mode": "M0",
          "candidate_category": "E0",
          "signals": [],
          "notes": "No safety signals present at session opening. Standard M0 process support is appropriate. No basis yet for identifying vulnerability, coercion, or incapacity concerns \u2014 these will require monitoring as parties begin to engage.",
          "safe_to_proceed_to_synthesis": true
        },
        "response_synthesis": {
          "phase": "session_framing",
          "message_summary": "Session opening \u2014 establish Solomon's role, set process expectations, and invite parties to begin articulating their concerns",
          "message_text": "Welcome to both of you. I'm Solomon, and I'm here to support the structure of this mediation session \u2014 not to make decisions for you, but to help you both surface what matters, identify where your interests might align, and work toward agreements that you both can accept.\n\nA few things about how this works: I'm neutral. I won't take sides or tell you what the right outcome is. I'm also not a lawyer or a therapist \u2014 if legal questions come up, or if either of you needs support beyond what this process can offer, I'll flag that. My role is to keep this process safe, structured, and focused on your interests.\n\nWhat I'd like to do now is hear from each of you about what brings you here \u2014 what decisions need to be made, and what concerns you're carrying into this conversation. There's no right order, but I need to hear from both of you before we start working on options.\n\nWho would like to start?",
          "grounded_in_perception": true,
          "options_introduced": [],
          "confidence_note": "Turn 1 opening statement. Perception will require updating once parties engage. Process design is standard session framing \u2014 role clarification, neutrality statement, and invitation to speak."
        },
        "pre_computed_domain_analysis": {
          "schema_version": "domain_analysis.v0",
          "source": "domain_reasoner_v0",
          "option_readiness": "blocked",
          "readiness_rationale": "Turn 1 is in session_framing phase. No party positions, interests, or issue content have been presented yet. The session has just begun and parties have not had an opportunity to speak. This is a fundamental information absence that prevents any option work - we do not know what issues are in dispute, what either party's position is, or what their underlying interests are. Option work cannot proceed until at least one party has articulated their concerns and the other party has had an opportunity to respond.",
          "safety_veto_applied": false,
          "safety_veto_reason": null,
          "qualified_candidates": [],
          "blocking_constraints": [
            {
              "constraint": "No party input has been received - session just beginning",
              "severity": "critical",
              "what_would_resolve_it": "At least one party needs to articulate their position/concerns, and ideally both parties should have had an opportunity to be heard before option work can begin"
            },
            {
              "constraint": "Issue domain is completely unidentified",
              "severity": "critical",
              "what_would_resolve_it": "Parties need to identify what disputes or decisions need to be addressed (e.g., parenting schedule, expense coordination, property division, etc.)"
            }
          ],